{
  "schema_version": "1.0.0",
  "id": "ASM-EAT-004-M01",
  "module_id": "EAT-004-M01",
  "target_mastery": "M2",
  "evidence_required": [
    "Output del test e confronto manifest/lockfile prima e dopo il cambio di versione.",
    "Spiegazione di npm ci, semver e package indipendenti."
  ],
  "rubric": [
    {
      "id": "R1",
      "criterion": "Manifest e lockfile coerenti",
      "max_score": 2,
      "anchors": {
        "zero": "Non produce evidenza o interpreta il comportamento in modo errato.",
        "partial": "Completa il task con checklist, ma la diagnosi richiede un hint ulteriore.",
        "full": "Completa con checklist, predice il risultato e spiega errore e verifica."
      }
    },
    {
      "id": "R2",
      "criterion": "Test riproducibile e versione runtime",
      "max_score": 2,
      "anchors": {
        "zero": "Non produce evidenza o interpreta il comportamento in modo errato.",
        "partial": "Completa il task con checklist, ma la diagnosi richiede un hint ulteriore.",
        "full": "Completa con checklist, predice il risultato e spiega errore e verifica."
      }
    },
    {
      "id": "R3",
      "criterion": "Install strategy e boundary dei package",
      "max_score": 2,
      "anchors": {
        "zero": "Non produce evidenza o interpreta il comportamento in modo errato.",
        "partial": "Completa il task con checklist, ma la diagnosi richiede un hint ulteriore.",
        "full": "Completa con checklist, predice il risultato e spiega errore e verifica."
      }
    }
  ],
  "pass_rule": {
    "minimum_score": 5,
    "blocking_errors": [
      "Modifica file fuori dalla directory fixture assegnata.",
      "Usa credenziali reali o sostituisce il tentativo personale con una soluzione LLM."
    ]
  },
  "retry_policy": "Ripeti su una nuova fixture, annota la causa del fallimento e conserva entrambe le prove. Attendi una nuova valutazione prima di attribuire il livello."
}
