{
  "schema_version": "1.0.0",
  "id": "ASM-EAT-002-M01",
  "module_id": "EAT-002-M01",
  "target_mastery": "M2",
  "evidence_required": [
    "Tabella di status, diff e diff staged prima e dopo il commit.",
    "Hash del commit fixture e verifica delle versioni working tree/index/HEAD."
  ],
  "rubric": [
    {
      "id": "R1",
      "criterion": "Distinzione working tree/index/HEAD",
      "max_score": 2,
      "anchors": {
        "zero": "Non produce evidenza o interpreta il comportamento in modo errato.",
        "partial": "Completa il task con checklist, ma la diagnosi richiede un hint ulteriore.",
        "full": "Completa con checklist, predice il risultato e spiega errore e verifica."
      }
    },
    {
      "id": "R2",
      "criterion": "Snapshot delimitato e diff motivati",
      "max_score": 2,
      "anchors": {
        "zero": "Non produce evidenza o interpreta il comportamento in modo errato.",
        "partial": "Completa il task con checklist, ma la diagnosi richiede un hint ulteriore.",
        "full": "Completa con checklist, predice il risultato e spiega errore e verifica."
      }
    },
    {
      "id": "R3",
      "criterion": "Lettura dello stato prima delle azioni",
      "max_score": 2,
      "anchors": {
        "zero": "Non produce evidenza o interpreta il comportamento in modo errato.",
        "partial": "Completa il task con checklist, ma la diagnosi richiede un hint ulteriore.",
        "full": "Completa con checklist, predice il risultato e spiega errore e verifica."
      }
    }
  ],
  "pass_rule": {
    "minimum_score": 5,
    "blocking_errors": [
      "Modifica file fuori dalla directory fixture assegnata.",
      "Usa credenziali reali o sostituisce il tentativo personale con una soluzione LLM."
    ]
  },
  "retry_policy": "Ripeti su una nuova fixture, annota la causa del fallimento e conserva entrambe le prove. Attendi una nuova valutazione prima di attribuire il livello."
}
