{
  "schema_version": "1.0.0",
  "id": "ASM-EAT-001-M02",
  "module_id": "EAT-001-M02",
  "target_mastery": "M2",
  "evidence_required": [
    "Diff dei tre script corretti nella copia della fixture.",
    "Spiegazione del numero di argomenti, del path risolto e della variabile innocua."
  ],
  "rubric": [
    {
      "id": "R1",
      "criterion": "Diagnosi dei tre difetti",
      "max_score": 2,
      "anchors": {
        "zero": "Non produce evidenza o interpreta il comportamento in modo errato.",
        "partial": "Completa il task con checklist, ma la diagnosi richiede un hint ulteriore.",
        "full": "Completa con checklist, predice il risultato e spiega errore e verifica."
      }
    },
    {
      "id": "R2",
      "criterion": "Quoting e traduzione Bash/PowerShell",
      "max_score": 2,
      "anchors": {
        "zero": "Non produce evidenza o interpreta il comportamento in modo errato.",
        "partial": "Completa il task con checklist, ma la diagnosi richiede un hint ulteriore.",
        "full": "Completa con checklist, predice il risultato e spiega errore e verifica."
      }
    },
    {
      "id": "R3",
      "criterion": "Environment minimo e scritture confinate",
      "max_score": 2,
      "anchors": {
        "zero": "Non produce evidenza o interpreta il comportamento in modo errato.",
        "partial": "Completa il task con checklist, ma la diagnosi richiede un hint ulteriore.",
        "full": "Completa con checklist, predice il risultato e spiega errore e verifica."
      }
    }
  ],
  "pass_rule": {
    "minimum_score": 5,
    "blocking_errors": [
      "Modifica file fuori dalla directory fixture assegnata.",
      "Usa credenziali reali o sostituisce il tentativo personale con una soluzione LLM."
    ]
  },
  "retry_policy": "Ripeti su una nuova fixture, annota la causa del fallimento e conserva entrambe le prove. Attendi una nuova valutazione prima di attribuire il livello."
}
